query,topic
"What are the main differences between a monarchy and a democracy?","history"
"Explain the concept of Schrödinger's cat in quantum physics.","physics"
"Write a short story about a time traveler who visits ancient Egypt.","creativity"
"What are the economic implications of AI on global job markets?","economics"
"Describe the lifecycle of a butterfly.","science"
"Assume you are Sherlock Holmes and explain how you deduced a mystery.","creativity"
"What is the capital city of Japan, and what is its cultural significance?","history"
"Code in Python to find the maximum profit in the stock buy-and-sell problem.","coding"
"Who was Cleopatra, and why is she considered a significant historical figure?","history"
"Compose a haiku about the beauty of autumn.","literature"
"What are the psychological effects of social media on teenagers?","psychology"
"Explain the working principles of blockchain technology.","coding"
"Describe the process of nuclear fusion in stars.","physics"
"Write a dialogue between Romeo and Juliet set in the modern world.","creativity"
"What are the primary causes and consequences of global warming?","science"
"Who is Elon Musk, and what is his impact on the tech industry?","history"
"Code in JavaScript to implement a basic to-do list application.","coding"
"What were the key events of World War II?","history"
"Write a limerick about a curious cat.","literature"
"Explain the significance of the discovery of penicillin.","science"
"What are the cultural differences between Eastern and Western societies?","history"
"Describe the plot of 'Hamlet' in simple terms.","literature"
"What is the significance of photosynthesis in the Earth's ecosystem?","science"
"Code in C++ to solve the Longest Common Subsequence problem.","coding"
"Who is Nelson Mandela, and what did he achieve during his lifetime?","history"
"Write a persuasive essay on the importance of renewable energy.","creativity"
"How do cryptocurrencies like Bitcoin function?","economics"
"Describe the history and evolution of space exploration.","history"
"What is the Pythagorean theorem, and how is it applied in geometry?","math"
"Write a motivational speech as though you are Martin Luther King Jr.","creativity"
"Explain the principles of supply and demand in economics.","economics"
"What are the benefits of mindfulness meditation?","psychology"
"Who was Mahatma Gandhi, and what role did he play in India's independence?","history"
"Code in Python to calculate the factorial of a number using recursion.","coding"
"What is the purpose of the United Nations, and how does it function?","history"
"Write a poem about the resilience of the human spirit.","literature"
"What are the ethical implications of cloning technology?","science"
"Describe the structure and function of the human heart.","science"
"Assume you are Hamlet and explain your thoughts on revenge.","literature"
"What is the theory of evolution, and who proposed it?","science"
"Code in C to reverse a linked list.","coding"
"Who was Saddam Hussein, and what was his role in Iraq’s history?","history"
"What are the cultural and historical highlights of the Renaissance?","history"
"Write a song lyric about unrequited love.","literature"
"Explain the process of rain formation in the water cycle.","science"
"What is the difference between machine learning and deep learning?","coding"
"Who is Kamala Harris, and what are her contributions to politics?","history"
"Code in Java to implement a binary search algorithm.","coding"
"What are the effects of deforestation on biodiversity?","science"
"Write a short story about a robot developing human emotions.","creativity"
